_id,index,guid,isActive,balance,picture,age,eyeColor,name,gender,company,email,phone,address,about,registered,latitude,longitude,greeting,favoriteFruit
5b5f3bd3651a807d9abdef63,38,5d9459a-983-4221-a382-fb6a9bba5da,False,"$3,774.39",http://placehold.it/32x32,39,green,Carla Weeks,female,COMBOGEN,carlaweeks@combogen.com,+1 (888) 503-3497,"140 Shale Street, Torboy, Northern Mariana Islands, 6509","Dolore anim fugiat ipsum occaecat. Consectetur laborum occaecat aliqua aute qui fugiat ex cupidatat quis commodo ea in qui. Nulla ullamco id aliquip proident exercitation nulla veniam culpa. Anim dolore anim Lorem sit enim aliqua qui aliquip excepteur in tempor sunt ullamco voluptate.
",11/12/2016 09.11.21,-68.230887,-123.666714,"Hello, Carla Weeks! You have 10 unread messages.",apple
5b5f3bd3267d6814640abd6e,39,d2b202-326b-42f6-adb4-8bca0226105,True,"$1,512.31",http://placehold.it/32x32,31,brown,Tamera Shaffer,female,FRANSCENE,tamerashaffer@franscene.com,+1 (900) 493-3069,"819 Albemarle Road, Bendon, Idaho, 1161","Culpa sunt magna exercitation ut nisi nulla adipisicing do pariatur eiusmod magna laboris. Proident ullamco ea qui enim non exercitation qui cillum ipsum ullamco duis magna. Qui nulla proident eu amet proident dolore adipisicing tempor. Ad consequat excepteur anim consectetur magna culpa fugiat non ad commodo culpa Lorem. Laborum commodo non incididunt enim nostrud adipisicing aute enim duis minim laboris et. Eiusmod aute enim est id culpa pariatur aliqua velit qui ullamco deserunt reprehenderit ex.
",12/12/2015 02.24.06,50.372383,153.143469,"Hello, Tamera Shaffer! You have 7 unread messages.",apple
5b5f3bd300fd90b242891b7a,40,e9c81845-a8fc-4b8-8242-9924260029ba,True,"$1,498.01",http://placehold.it/32x32,36,brown,May Rasmussen,male,ZENSOR,mayrasmussen@zensor.com,+1 (939) 401-2762,"231 Ebony Court, Barrelville, Ohio, 9231","Sit occaecat enim officia cupidatat fugiat excepteur elit qui aliqua deserunt. Quis eu voluptate id magna sunt nostrud minim adipisicing nisi. Exercitation ad non adipisicing in ex culpa incididunt laborum sit ullamco cupidatat ea laborum consequat. Aliquip non elit Lorem eu aute eu et est. Officia qui id sit ea est sint minim pariatur adipisicing eu aliquip. Commodo sit nostrud id et duis.
",13/10/2016 02.42.14,-25.028212,100.392244,"Hello, May Rasmussen! You have 8 unread messages.",apple
5b5f3bd331981d4d3b764e3e,41,ef0630d-f3f-43b9-86b5-d914016fd851,False,"$1,541.24",http://placehold.it/32x32,31,blue,Hannah Fletcher,female,PASTURIA,hannahfletcher@pasturia.com,+1 (945) 525-2409,"907 Noel Avenue, Ona, South Dakota, 6674","Voluptate eu commodo eu ut id velit Lorem voluptate incididunt do sit labore laborum anim. Ut voluptate officia eu sunt amet nulla voluptate sint Lorem cillum aute. Officia ut minim id dolor velit aute non. Ut minim exercitation cupidatat officia do aute non ad.
",03/07/2018 01.30.21,12.303173,-123.165258,"Hello, Hannah Fletcher! You have 8 unread messages.",apple
5b5f3bd336c012a63598cf27,42,124e1f4-e528-4564-919-15e63205669f,False,"$2,139.34",http://placehold.it/32x32,29,green,Marie Weaver,female,SKYPLEX,marieweaver@skyplex.com,+1 (897) 550-2158,"993 Columbia Place, Elizaville, Oregon, 2044","Veniam magna duis Lorem elit ea sit. Ea fugiat ipsum incididunt ut sint mollit ipsum laborum ipsum. Ut labore magna do duis enim in esse cupidatat. Adipisicing laboris proident mollit dolor commodo non consequat.
",15/02/2018 02.00.02,-31.118918,169.291645,"Hello, Marie Weaver! You have 7 unread messages.",banana
5b5f3bd385094e817b92882b,43,198c0cc9-cfc-40a5-823-b92b6e8993d,False,"$2,253.77",http://placehold.it/32x32,32,brown,Leigh Guzman,female,UNISURE,leighguzman@unisure.com,+1 (978) 434-2056,"489 Calyer Street, Dargan, Georgia, 171","Duis ea laboris eu minim. In nulla culpa id pariatur consectetur et velit pariatur ex sint ea Lorem cillum. Eiusmod proident pariatur mollit in id commodo laboris. Ullamco irure deserunt exercitation mollit cillum in velit.
",04/03/2017 02.54.38,7.902325,10.690565,"Hello, Leigh Guzman! You have 2 unread messages.",strawberry
5b5f3bd3f7b636d901561fc7,44,90181eb5-cd4d-454d-b8b3-cd3d13cca966,False,"$1,236.59",http://placehold.it/32x32,32,green,Odom Clay,male,DATAGEN,odomclay@datagen.com,+1 (869) 532-3986,"352 Cedar Street, Durham, Michigan, 4973","Cupidatat reprehenderit officia minim nulla enim exercitation velit nulla ad officia ut. Ipsum nulla aliquip sit commodo. Aliqua culpa laboris deserunt reprehenderit sint eu dolor officia incididunt. Enim adipisicing eu non officia laborum minim voluptate exercitation pariatur occaecat sit consectetur aliquip irure. Dolor enim incididunt commodo aliquip.
",30/04/2015 03.20.35,11.037858,102.127949,"Hello, Odom Clay! You have 7 unread messages.",apple
5b5f3bd35a49bee9f5213b7d,45,29ef33e4-f96-48e-b82d-22a0e5b68004,True,"$2,821.14",http://placehold.it/32x32,25,brown,Anthony Battle,male,MARVANE,anthonybattle@marvane.com,+1 (983) 430-2059,"237 Lake Avenue, Emerald, District Of Columbia, 4995","Laboris velit culpa laboris excepteur irure ullamco duis non ut deserunt anim. Ut exercitation officia nisi dolor excepteur Lorem aliqua ut elit magna pariatur duis. Labore est et occaecat elit et laboris minim aliqua exercitation aute laborum nulla eu sit. Dolore sunt duis laboris est occaecat ex do culpa. Consectetur et veniam nulla ex in laborum cillum nostrud ut dolor nulla.
",28/01/2016 08.35.33,0.905929,175.64276,"Hello, Anthony Battle! You have 1 unread messages.",apple
5b5f3bd393375e41da5159b0,46,0c2b2b56-d0a-4e33-b03e-dff905ae4,True,"$3,757.45",http://placehold.it/32x32,23,brown,Raymond Vinson,male,SYNTAC,raymondvinson@syntac.com,+1 (823) 516-2053,"362 Congress Street, Sattley, Colorado, 6787","Reprehenderit fugiat aute minim ullamco velit in esse ullamco esse commodo. Qui aliquip in fugiat reprehenderit aute quis mollit sint. Magna nisi exercitation cupidatat veniam proident officia commodo aliqua. Esse sint nisi dolore magna duis aliquip duis reprehenderit ad non esse sunt. Enim nostrud aute ipsum irure esse culpa labore occaecat deserunt aliqua. Dolor commodo consectetur consectetur proident velit elit veniam exercitation quis consectetur pariatur velit ipsum.
",05/10/2017 11.26.16,-11.844592,43.088607,"Hello, Raymond Vinson! You have 4 unread messages.",apple
5b5f3bd3ae38c573eb7a6ffa,47,e2d546e1-a122-41b-89ac-23183bbadec,True,"$2,334.24",http://placehold.it/32x32,39,blue,Lou Stein,female,KOOGLE,loustein@koogle.com,+1 (832) 499-3210,"453 Aurelia Court, Warren, Iowa, 6317","Incididunt ex in enim non dolore consequat officia anim sunt. Culpa et deserunt id quis dolor. Qui eu adipisicing proident proident commodo exercitation esse esse cillum anim labore ea qui. Excepteur do dolore mollit et sit. Exercitation est consequat eu dolore est officia adipisicing duis culpa deserunt cupidatat excepteur occaecat dolore. Minim aliquip cupidatat tempor incididunt irure velit enim Lorem ex.
",22/01/2015 07.11.07,-48.800283,25.839815,"Hello, Lou Stein! You have 3 unread messages.",apple
5b5f3bd346e4c05efdc3938a,48,24e8a18f-4d2-4d06-9542-411d1132dbe,False,"$2,387.20",http://placehold.it/32x32,24,brown,Hardy Macdonald,male,CINCYR,hardymacdonald@cincyr.com,+1 (898) 549-2183,"352 Tabor Court, Garnet, American Samoa, 3824","Do deserunt minim irure eu est labore consequat eu veniam cillum tempor cillum ea quis. Labore ea irure in reprehenderit. Et veniam ut esse culpa commodo minim non. Nulla adipisicing aliqua qui ex. Id ipsum adipisicing esse eu et nostrud.
",15/07/2018 05.58.48,-70.015011,-172.093676,"Hello, Hardy Macdonald! You have 6 unread messages.",strawberry
5b5f3bd38cf80a73beec4556,49,aa6be59f-ab14-4139-9c48-5501f8feb3,True,"$3,981.20",http://placehold.it/32x32,25,green,Calhoun Garcia,male,ZAGGLES,calhoungarcia@zaggles.com,+1 (858) 446-2526,"855 Hunts Lane, Coventry, Utah, 2881","Voluptate dolor quis velit qui nulla ut est dolore mollit nisi do consectetur sit. Do Lorem tempor in fugiat quis mollit. Fugiat in adipisicing anim nulla eiusmod pariatur ex officia enim ad nostrud minim elit. Sunt exercitation sit ut labore deserunt irure.
",12/02/2016 09.55.26,57.892078,56.483142,"Hello, Calhoun Garcia! You have 2 unread messages.",apple
5b5f3bd337b95694f983f198,50,39c6495a-1d-4d3-8b4f-39fcba0fb4,False,"$3,822.07",http://placehold.it/32x32,32,blue,Everett Navarro,male,DATAGENE,everettnavarro@datagene.com,+1 (913) 502-2636,"676 Russell Street, Chamizal, Alaska, 9066","Nulla dolore ullamco duis elit aliquip laborum cillum aliqua adipisicing sit minim. Magna nulla incididunt ex dolor occaecat esse sit fugiat adipisicing mollit sint nulla consequat mollit. Laboris esse quis eiusmod adipisicing enim reprehenderit. Aliquip Lorem enim sint consectetur. Proident exercitation cillum sint nostrud nulla amet proident.
",12/02/2016 02.52.34,60.467534,60.206139,"Hello, Everett Navarro! You have 9 unread messages.",banana
5b5f3bd3004fe08aba5a293e,51,c32eb06e-c49e-44d4-bcd2-ed398445f6,True,"$1,984.82",http://placehold.it/32x32,28,brown,Fulton Romero,male,HIVEDOM,fultonromero@hivedom.com,+1 (994) 565-3570,"648 Hendrickson Street, Orick, Arkansas, 2510","Sunt anim aliquip nulla magna sint commodo ullamco ullamco labore laboris cupidatat. Magna nisi tempor ad nostrud. Ullamco ex ut cillum ipsum nisi et eiusmod nostrud sunt voluptate sunt irure ullamco consectetur. Eu exercitation mollit consectetur eu veniam adipisicing voluptate anim cupidatat Lorem cupidatat amet aliqua ipsum. Duis sit nostrud eiusmod tempor esse esse aliqua ut id id irure veniam magna. In laboris culpa quis in dolor id pariatur ex mollit nisi aute officia.
",20/03/2015 02.27.23,17.342862,99.295981,"Hello, Fulton Romero! You have 9 unread messages.",strawberry
5b5f3bd325b4fae70f3aa553,52,d8899290-95fd-403b-a98c-1ac125c11aed,False,"$3,572.17",http://placehold.it/32x32,35,blue,Francis Charles,female,VOLAX,francischarles@volax.com,+1 (803) 550-2821,"593 Varick Street, Turpin, West Virginia, 4602","Eiusmod labore veniam adipisicing nulla sunt. Id eu occaecat est do incididunt labore ullamco aute eiusmod. Ipsum voluptate quis cillum dolor amet irure non sunt velit sunt velit enim aute minim.
",14/07/2015 10.45.22,46.11905,-169.136295,"Hello, Francis Charles! You have 5 unread messages.",strawberry
5b5f3bd3735ab6d99aa03ae6,53,8596302-f14b-4334-96c-ac9823fe60d,True,"$1,964.87",http://placehold.it/32x32,26,brown,Suzanne Barry,female,CRUSTATIA,suzannebarry@crustatia.com,+1 (848) 541-3694,"875 Amherst Street, Fairview, North Dakota, 7690","Nisi ut ipsum esse sunt aute aute Lorem dolor labore labore pariatur. Ex et qui qui nostrud ut enim dolor. Occaecat eu duis eu enim et dolore sunt tempor do irure anim mollit. Aliqua culpa excepteur Lorem ea ea laboris.
",26/07/2017 03.00.43,67.700054,98.590495,"Hello, Suzanne Barry! You have 1 unread messages.",apple
5b5f3bd3c634c2a66c4add1b,54,2ef3dd-3b0e-4e15-b3fd-010c5af403b,True,"$1,179.71",http://placehold.it/32x32,38,blue,Melba Mccullough,female,FUTURITY,melbamccullough@futurity.com,+1 (903) 533-3380,"485 Pilling Street, Brantleyville, California, 393","Incididunt sit proident ex non commodo minim voluptate velit nostrud cupidatat fugiat in culpa. Ex dolore nisi exercitation non. Quis amet esse Lorem elit cillum. Sint velit ipsum do magna officia cillum laborum aliqua aliqua sit pariatur ullamco sit do. Commodo aliquip nisi incididunt eu et eiusmod velit adipisicing. Laborum consequat sit labore qui quis velit amet elit quis tempor eiusmod aliqua.
",12/07/2015 01.08.53,60.973312,-1.290214,"Hello, Melba Mccullough! You have 4 unread messages.",apple
5b5f3bd39ee43cec6416873a,55,63489652-1cd3-4c8-be19-d805e50f94b,False,"$1,943.13",http://placehold.it/32x32,37,blue,Tonia Moran,female,SLAX,toniamoran@slax.com,+1 (902) 431-2447,"489 Kimball Street, Taft, Arizona, 3816","Veniam velit qui et aliqua fugiat. Aliqua sint nulla dolore labore cupidatat non aute ullamco laboris. Nulla aliqua nostrud magna proident officia est commodo proident adipisicing in irure sint dolore est.
",30/05/2015 03.44.18,75.31688,158.738089,"Hello, Tonia Moran! You have 6 unread messages.",banana
5b5f3bd3e2008817ace8dcf9,56,bae89486-6049-44b2-a298-63bda6251,False,"$3,894.32",http://placehold.it/32x32,30,brown,Shannon Long,female,REMOTION,shannonlong@remotion.com,+1 (958) 450-3336,"543 Rodney Street, Lynn, New Jersey, 3274","Laboris est velit laborum proident minim ad id consectetur tempor cupidatat. Aliquip voluptate fugiat nulla consectetur consectetur occaecat ad magna dolore occaecat et elit. Eiusmod elit nulla mollit sunt nisi occaecat adipisicing ipsum dolore enim eiusmod consequat pariatur. Sit excepteur aliqua id dolor eu pariatur deserunt tempor voluptate pariatur. Exercitation do dolore labore exercitation fugiat laboris laborum anim mollit eiusmod eu dolor. Exercitation amet deserunt cillum aliqua aliquip. Cillum sint fugiat nisi enim occaecat non enim do qui sint irure.
",08/11/2016 06.03.58,-63.842403,-66.672643,"Hello, Shannon Long! You have 10 unread messages.",banana
5b5f3bd3a9047b918a176bab,57,1b9a692-02bb-4604-9e6d-620b956dc4a0,True,"$2,296.39",http://placehold.it/32x32,31,brown,Espinoza Carroll,male,GRACKER,espinozacarroll@gracker.com,+1 (832) 557-2105,"815 Juliana Place, Como, Montana, 1275","Laboris non et incididunt incididunt ad velit officia cupidatat dolor cillum adipisicing tempor fugiat laboris. Elit laboris quis in aute anim labore Lorem sit. Ea consectetur et proident elit dolor ea. Incididunt dolor id aliqua officia incididunt quis laborum quis consequat eu proident veniam. Sunt nulla ullamco aute officia ex est sit.
",13/11/2017 05.57.36,-2.45542,144.333459,"Hello, Espinoza Carroll! You have 3 unread messages.",strawberry
5b5f3bd381a0f5edd7926423,58,b8d5a1-16-4bd2-8e44-bdf43459f310,True,"$1,219.07",http://placehold.it/32x32,22,brown,Rios Cunningham,male,ZYPLE,rioscunningham@zyple.com,+1 (800) 518-3571,"346 Conover Street, Kaka, Nevada, 7489","Excepteur nostrud nisi excepteur consectetur excepteur veniam deserunt elit. Qui pariatur sint voluptate consectetur Lorem non nostrud id labore aliqua ut culpa sit. Nulla occaecat velit ea ipsum.
",14/07/2015 11.11.07,34.176526,-116.059873,"Hello, Rios Cunningham! You have 1 unread messages.",strawberry
5b5f3bd382293502efe76bd8,59,4df10c98-328d-41ca-a496-945854321bf,True,"$1,646.32",http://placehold.it/32x32,40,brown,Sampson Pennington,male,SENMEI,sampsonpennington@senmei.com,+1 (922) 405-3609,"424 Vandalia Avenue, Interlochen, Palau, 1230","Veniam excepteur voluptate deserunt officia ex cillum consectetur magna ad enim nulla. Nostrud irure enim ex aliqua ad exercitation fugiat cupidatat dolore laborum duis veniam nulla id. Elit dolor sit quis incididunt. Dolore dolore deserunt minim magna est nulla duis. Irure nulla proident sit adipisicing eiusmod sit pariatur. Aliquip sunt ea enim nisi irure occaecat do do minim et tempor. Incididunt ex irure exercitation enim esse eiusmod aliquip dolore quis do dolore velit.
",20/10/2017 06.19.56,-20.356846,-118.028694,"Hello, Sampson Pennington! You have 1 unread messages.",banana
5b5f3bd3e56c7b1e00fafc21,60,2fffb9e5-63dd-441-bf29-ec48e3c00995,True,"$2,442.85",http://placehold.it/32x32,23,brown,Loretta Chan,female,COMTEST,lorettachan@comtest.com,+1 (861) 593-2286,"308 Elm Avenue, Matheny, Hawaii, 8485","Laboris sit fugiat consequat cupidatat anim et exercitation enim id enim amet consectetur deserunt. Eiusmod laborum velit magna in cupidatat duis eiusmod anim. Ex consectetur sint non proident excepteur proident cupidatat tempor. Est mollit fugiat ut nisi laboris irure id est non sunt Lorem ut exercitation. Sint et reprehenderit irure irure amet deserunt ea ad voluptate officia anim. Elit sint sit minim exercitation. Laboris dolor ea elit esse.
",04/09/2017 01.12.07,-56.352619,-53.71428,"Hello, Loretta Chan! You have 4 unread messages.",banana
5b5f3bd32329b35e2ac421ad,61,62afc4b-af8f-4aa3-9a02-e1242d1c2463,True,"$1,879.97",http://placehold.it/32x32,29,green,Blanche Howe,female,RODEMCO,blanchehowe@rodemco.com,+1 (969) 564-2213,"168 Manhattan Avenue, Cavalero, Oklahoma, 2433","Ipsum nostrud elit proident aute Lorem aliqua ex proident. Sunt quis pariatur eiusmod ipsum in ex culpa dolore duis eu labore reprehenderit veniam. Ex sint aute excepteur ea adipisicing pariatur sit irure eiusmod nulla cillum exercitation. Dolor ut ipsum incididunt ipsum mollit commodo dolore cillum eu laborum cillum ut proident enim. Aute qui in irure nostrud magna magna elit sit ipsum duis. Sint eu aliqua cillum sit qui sunt dolor dolor enim occaecat mollit qui sunt velit. Ut nulla tempor consectetur commodo.
",10/04/2017 01.04.28,-7.222818,177.109225,"Hello, Blanche Howe! You have 3 unread messages.",strawberry
5b5f3bd30ab07c9195b10032,62,ba48d356-19ff-443-bfe-62eb6d2ca362,False,"$2,570.84",http://placehold.it/32x32,36,blue,Reynolds Estes,male,SCENTY,reynoldsestes@scenty.com,+1 (850) 446-3835,"371 Catherine Street, Kula, New Hampshire, 3006","Magna et pariatur sunt nisi sit officia. In non dolore laboris labore sit laboris. Id occaecat nisi quis tempor proident aliquip sunt. Aute consectetur sint officia ex occaecat duis.
",10/02/2016 12.24.24,66.107869,109.716328,"Hello, Reynolds Estes! You have 9 unread messages.",banana
5b5f3bd3aab3b9ad243948dd,63,64d85f0c-1d80-4acf-8882-8db8eee200,False,"$2,904.31",http://placehold.it/32x32,33,brown,Rosario Delgado,female,RUBADUB,rosariodelgado@rubadub.com,+1 (918) 461-2487,"812 Oak Street, Yorklyn, Washington, 3676","Aliquip ex minim velit eu ullamco mollit eu incididunt veniam. Duis nostrud dolor adipisicing dolor. Ea sit pariatur nostrud non eu dolore eiusmod adipisicing esse sunt magna officia nostrud mollit.
",13/09/2015 11.42.35,-82.841657,-78.791107,"Hello, Rosario Delgado! You have 3 unread messages.",apple
5b5f3bd319fa91a80ae642cf,64,96efbbd8-3fd1-4f20-91d6-6e26a1168dcf,True,"$3,892.11",http://placehold.it/32x32,25,brown,Trudy Sheppard,female,SOPRANO,trudysheppard@soprano.com,+1 (909) 559-3915,"477 Willoughby Avenue, Why, Mississippi, 3906","Eu minim commodo sint cupidatat sunt mollit irure id eu cupidatat veniam ut nulla. Excepteur id enim reprehenderit officia eiusmod incididunt amet. Magna mollit elit voluptate officia fugiat minim deserunt amet in qui do in ut. Nisi laboris ut culpa voluptate tempor eu tempor nisi. Lorem tempor non ea proident aliqua dolor nisi.
",24/12/2017 03.14.11,-69.784311,164.733365,"Hello, Trudy Sheppard! You have 4 unread messages.",apple
5b5f3bd30d87532762e65851,65,4aa3d49-f18-4f2b-8c88-820643d0f635,True,"$2,669.83",http://placehold.it/32x32,37,blue,Graves Fisher,male,INCUBUS,gravesfisher@incubus.com,+1 (942) 508-3516,"881 Caton Avenue, Lookingglass, Delaware, 1866","Eiusmod cillum qui elit proident nostrud sunt ullamco magna sit ad do dolore. Occaecat sit deserunt laboris laboris ipsum eu culpa aliqua sit laborum nostrud mollit. Cillum est laborum tempor culpa sunt irure pariatur eiusmod laboris. Reprehenderit nulla nulla et in cillum dolore dolor labore dolore. Anim amet excepteur eiusmod voluptate dolor deserunt in.
",02/09/2015 09.08.00,-3.015075,-145.275451,"Hello, Graves Fisher! You have 2 unread messages.",strawberry
5b5f3bd310f2decb8143bb25,66,8ffa3225-cdba-490-93fa-8604a65136f,False,"$2,571.49",http://placehold.it/32x32,31,brown,Sylvia Bass,female,NURALI,sylviabass@nurali.com,+1 (966) 531-2550,"850 Lafayette Walk, Montura, Puerto Rico, 7135","Ad elit enim eiusmod nulla irure labore excepteur occaecat irure voluptate ipsum aliquip ipsum. Enim qui sit ad mollit elit ea nostrud incididunt minim ipsum. Sunt sunt quis eiusmod cupidatat irure et laborum do dolor qui. Dolor dolor labore sunt velit pariatur occaecat consequat. Pariatur cillum incididunt sunt proident aliqua sint non et. Nisi ad adipisicing incididunt laborum sunt nulla.
",21/02/2017 05.27.57,58.165726,-79.110146,"Hello, Sylvia Bass! You have 3 unread messages.",strawberry
5b5f3bd39e719edf9a73962c,67,ce518944-6af3-4c19-8128-54b0161343e,False,"$1,891.24",http://placehold.it/32x32,28,green,Deborah Avila,female,BULLJUICE,deborahavila@bulljuice.com,+1 (976) 525-3906,"113 Beayer Place, Harrison, North Carolina, 7544","Labore ex ipsum aute laboris. Et aliqua eiusmod quis consectetur. Eiusmod elit anim sunt velit dolor nulla consequat eu enim ex duis qui nisi. Enim laboris anim exercitation culpa ullamco aute aliqua velit dolor sunt do ut id nulla. Labore quis laborum cupidatat ex esse nisi exercitation enim consectetur non do minim enim consequat. Dolor reprehenderit in et esse id nostrud.
",21/10/2017 07.04.34,39.158974,-63.464112,"Hello, Deborah Avila! You have 9 unread messages.",banana
5b5f3bd31819e21e30184326,68,8650da5d-6c8f-4351-b0c9-2d4a92ca84e2,True,"$2,580.70",http://placehold.it/32x32,24,green,Cannon Marsh,male,ANIMALIA,cannonmarsh@animalia.com,+1 (841) 478-3082,"505 Stone Avenue, Ryderwood, Guam, 5252","Laboris laboris cupidatat commodo eiusmod nostrud velit ea cillum aliquip ex. Magna sunt cupidatat nisi quis consectetur culpa deserunt id proident. Nulla fugiat consequat amet eiusmod ut minim culpa.
",30/06/2016 05.16.57,-45.586331,116.84477,"Hello, Cannon Marsh! You have 2 unread messages.",strawberry
5b5f3bd362bf4b7bed5d46d8,69,8904d60-ab52-43cb-b62-68e45b05f59,True,"$2,654.99",http://placehold.it/32x32,40,blue,Blackburn Smith,male,ARTIQ,blackburnsmith@artiq.com,+1 (846) 508-2791,"574 Clifford Place, Carrsville, Wisconsin, 8188","Eu laboris anim irure culpa velit mollit ullamco elit et sint ad ea occaecat laborum. Incididunt laboris esse laboris enim et. Velit ullamco non ipsum aliquip officia anim consequat non. Elit sit irure nostrud qui. Laboris voluptate proident pariatur dolor. Tempor cupidatat incididunt pariatur ad sint nisi nulla mollit anim voluptate. Nostrud consectetur fugiat est officia labore cillum officia.
",09/05/2016 10.53.58,-82.608909,103.821753,"Hello, Blackburn Smith! You have 8 unread messages.",strawberry
5b5f3bd369b36500574791fd,70,36ec10a-dc5d-4950-a9e9-6ed5a38f0d,True,"$1,924.54",http://placehold.it/32x32,29,green,Liliana Barton,female,BRISTO,lilianabarton@bristo.com,+1 (898) 577-2827,"751 Grimes Road, Manchester, Indiana, 2542","Id quis et et aliquip veniam quis ipsum sint quis voluptate adipisicing consectetur magna eu. Aliquip ut excepteur ad officia enim aliqua cillum. Tempor veniam enim irure ipsum. Consequat eu magna incididunt adipisicing ex sit culpa aliquip.
",27/05/2015 11.39.30,33.258136,67.751024,"Hello, Liliana Barton! You have 1 unread messages.",strawberry
5b5f3bd3d2a0df3197f2bb46,71,1dca99cb-6b38-4989-9f1-3488cbad42fd,True,"$3,158.69",http://placehold.it/32x32,30,green,Clayton Wynn,male,ONTAGENE,claytonwynn@ontagene.com,+1 (962) 527-2183,"603 Newkirk Placez, Harrodsburg, Vermont, 7782","Elit voluptate laborum consectetur in cillum nostrud anim consectetur anim. Est do laborum aute culpa. Incididunt anim deserunt proident nisi non. Labore nulla proident qui ex officia elit quis pariatur cupidatat. Deserunt aute in ipsum reprehenderit labore.
",15/06/2016 05.17.47,43.424963,-147.518585,"Hello, Clayton Wynn! You have 4 unread messages.",apple
5b5f3bd3e42f5998e941b2b7,72,03b8aac-466d-434c-b12a-ff046fc60,True,"$3,739.81",http://placehold.it/32x32,20,green,Shelley Garrett,female,MAGMINA,shelleygarrett@magmina.com,+1 (860) 495-2204,"873 Arlington Avenue, Idamay, Texas, 3736","Fugiat dolor culpa eiusmod nulla occaecat est. Adipisicing commodo fugiat exercitation excepteur deserunt eiusmod incididunt do duis ex culpa ullamco deserunt. In nisi incididunt ut veniam adipisicing pariatur laborum dolor quis non.
",14/07/2014 01.26.56,-46.091191,110.866548,"Hello, Shelley Garrett! You have 8 unread messages.",apple
5b5f3bd36a82364851ab22b4,73,9fcd36f-2cea-40b-982-4e2c53925209,False,"$1,911.83",http://placehold.it/32x32,40,green,Carrie Huber,female,IMPERIUM,carriehuber@imperium.com,+1 (827) 405-3677,"740 Johnson Avenue, Efland, Alabama, 5659","Sunt sit proident minim enim in Lorem ipsum amet nostrud amet. Eu sit irure commodo deserunt consectetur non enim velit. Anim esse culpa dolor irure culpa consequat duis labore officia. Esse magna velit officia incididunt. Dolore consectetur deserunt tempor magna.
",15/01/2018 08.33.33,-1.969328,150.869219,"Hello, Carrie Huber! You have 7 unread messages.",strawberry
5b5f3bd3c2d5c9c033ab4b21,74,d0df691-1800-4a5e-999d-f8faaf4082c,False,"$3,268.27",http://placehold.it/32x32,23,brown,Randall White,male,APEXTRI,randallwhite@apextri.com,+1 (830) 574-3484,"988 Meadow Street, Lowgap, Louisiana, 7955","Ea ut ex mollit consectetur non qui anim proident irure commodo elit. Cupidatat laboris commodo excepteur labore sit quis anim nostrud ea. Velit voluptate ipsum esse sint tempor sunt commodo pariatur. Ullamco nostrud exercitation commodo qui magna aliquip enim dolore consectetur. Fugiat amet ea ex duis officia sint culpa.
",27/09/2017 12.39.45,-0.279037,51.313963,"Hello, Randall White! You have 2 unread messages.",strawberry
5b5f3bd3e903bfba431cb20a,75,086ffab-b002-4d0a-898f-a4e5193f4f,True,"$1,861.55",http://placehold.it/32x32,23,blue,Cecile Mccormick,female,ELENTRIX,cecilemccormick@elentrix.com,+1 (899) 442-2918,"801 Erskine Loop, Loyalhanna, Virgin Islands, 3837","Ipsum esse ad esse nisi veniam consectetur tempor consectetur cupidatat excepteur. Eiusmod occaecat culpa culpa aliqua cupidatat pariatur. Irure id voluptate dolore esse proident ullamco quis amet nostrud sit. Reprehenderit commodo qui nisi ad cupidatat id non exercitation tempor laboris officia.
",13/04/2015 01.53.06,-36.206784,-108.681085,"Hello, Cecile Mccormick! You have 9 unread messages.",banana
