_id,index,guid,isActive,balance,picture,age,eyeColor,name,gender,company,email,phone,address,about,registered,latitude,longitude,greeting,favoriteFruit
5b5f3bd38a0ee1ba8dd04b28,76,85b4bdc1-3065-438f-a938-e944e3d6d53,False,"$1,031.46",http://placehold.it/32x32,39,brown,Enid Neal,female,QUILCH,enidneal@quilch.com,+1 (983) 557-3499,"317 Kensington Street, Elfrida, Missouri, 6455","Enim sunt sint est fugiat amet officia ea excepteur velit nulla ipsum ullamco aliqua duis. Laborum labore officia magna sit proident laborum minim deserunt ex eiusmod cupidatat incididunt. Voluptate sint proident sunt irure mollit ea magna labore commodo veniam Lorem sit. Excepteur occaecat in dolore pariatur laboris magna et aliqua non nisi fugiat. Magna aute veniam commodo fugiat id quis laboris exercitation irure ipsum qui dolor qui occaecat.
",27/07/2018 11.19.44,-76.472914,173.074777,"Hello, Enid Neal! You have 8 unread messages.",apple
5b5f3bd30065555e2ab0e9b4,77,8e2482e4-8d19-4e62-8300-6c1df8dcd69,False,"$3,518.44",http://placehold.it/32x32,40,green,Tyson Hewitt,male,INTERFIND,tysonhewitt@interfind.com,+1 (963) 527-2573,"336 Louis Place, Bourg, Rhode Island, 1814","Lorem est ex ex laboris ullamco in enim. Do laboris occaecat incididunt fugiat sint Lorem consequat et sit sint esse. Enim minim aute cillum eu ex duis dolor deserunt sit sunt.
",22/05/2017 02.27.28,-5.184094,33.272672,"Hello, Tyson Hewitt! You have 8 unread messages.",banana
5b5f3bd32be983377b76f413,78,46a535f-9002-4db4-b8fa-52b0bcdab50d,True,"$2,168.86",http://placehold.it/32x32,35,green,Mindy Mann,female,DELPHIDE,mindymann@delphide.com,+1 (819) 501-2239,"407 Willoughby Street, Lafferty, Pennsylvania, 5393","Laboris ad qui ea pariatur nisi. Aliqua est ea eu irure proident. Exercitation duis excepteur elit reprehenderit voluptate exercitation anim tempor ut anim exercitation minim. Cillum id et laboris aliqua aliqua ipsum anim.
",07/05/2016 11.39.38,61.543014,114.573734,"Hello, Mindy Mann! You have 4 unread messages.",apple
5b5f3bd3070da8564811df9f,79,d14b059d-c23-4886-9ed2-b9e323031ce,True,"$2,049.97",http://placehold.it/32x32,32,blue,Wilma Massey,female,EZENT,wilmamassey@ezent.com,+1 (988) 443-2907,"599 Rutherford Place, Tyhee, Connecticut, 1104","Est ullamco nostrud eu reprehenderit cillum aliqua minim aliquip enim sint cupidatat aute. Lorem commodo commodo esse occaecat voluptate in. Pariatur ea irure dolor amet occaecat et veniam non aliqua sunt culpa consequat. Eiusmod magna incididunt qui occaecat. Nisi enim exercitation sit veniam. Dolor occaecat consequat veniam consequat velit tempor.
",03/02/2017 01.04.35,-87.198346,-29.394466,"Hello, Wilma Massey! You have 9 unread messages.",apple
5b5f3bd3e46cbfd6fb50dad4,80,4a909b15-c5e-4f9c-8a21-cbb8f0d82e99,False,"$3,280.66",http://placehold.it/32x32,40,brown,Lucinda Fitzpatrick,female,MANUFACT,lucindafitzpatrick@manufact.com,+1 (919) 599-2286,"295 Village Court, Orovada, Illinois, 2361","Nulla est nulla et veniam cupidatat officia proident excepteur in nisi. Velit amet et velit dolore. Do eiusmod labore nostrud fugiat minim ad non aute reprehenderit consequat nostrud labore velit sint. Nisi tempor velit labore duis ea culpa proident dolore et excepteur id mollit. In amet amet deserunt excepteur minim ad labore. Sunt duis anim anim ut fugiat quis mollit. Aliqua proident ullamco in enim duis cupidatat sint id.
",08/01/2016 09.37.22,-14.983695,-75.668737,"Hello, Lucinda Fitzpatrick! You have 2 unread messages.",apple
5b5f3bd36df5aa33a8085a43,81,b69fda-db3-402-a382-d5fcf689842d,True,"$3,236.73",http://placehold.it/32x32,26,blue,Gregory Sharp,male,FURNITECH,gregorysharp@furnitech.com,+1 (814) 479-3552,"558 Merit Court, Bedias, Federated States Of Micronesia, 6790","Id nulla excepteur culpa pariatur sint sit officia eiusmod elit eu velit nulla sunt exercitation. Officia Lorem laborum ut magna irure. Laborum laboris sint excepteur irure esse sint Lorem officia. Sint id ipsum aliquip dolor deserunt do. Voluptate ipsum exercitation nostrud ex elit aliqua ex eu.
",06/11/2014 09.02.31,48.919354,3.039524,"Hello, Gregory Sharp! You have 7 unread messages.",banana
5b5f3bd3272498e2810754c3,82,093011e-26e-4238-8f04-23b8809453fd,True,"$1,262.42",http://placehold.it/32x32,31,green,Lauren Blair,female,AMTAP,laurenblair@amtap.com,+1 (855) 538-3078,"326 Taaffe Place, Frierson, Wyoming, 479","Ut proident cupidatat dolore sunt sint ex aute elit velit. Irure ipsum deserunt incididunt cillum qui officia reprehenderit magna eiusmod commodo culpa nulla. Sunt proident tempor est nostrud veniam consectetur voluptate cupidatat. Duis est magna voluptate Lorem ea ex ad. Labore eiusmod voluptate esse do. Consectetur voluptate excepteur magna mollit in elit qui incididunt. Ad id ullamco esse exercitation cillum ipsum quis duis occaecat fugiat labore aliqua ipsum veniam.
",12/04/2014 06.45.41,88.785503,65.23783,"Hello, Lauren Blair! You have 4 unread messages.",apple
5b5f3bd3f688b75870c084e3,83,048a80-8ff8-4b4-8ea5-eeefa2f094f,True,"$3,203.42",http://placehold.it/32x32,31,green,Cindy Carson,female,TERRAGO,cindycarson@terrago.com,+1 (989) 443-3803,"705 Garfield Place, Wyoming, Kentucky, 6095","Aliquip et duis commodo sit nostrud deserunt. Eiusmod dolore officia amet fugiat. Magna excepteur fugiat occaecat occaecat fugiat. Aute mollit ipsum cupidatat voluptate enim adipisicing.
",22/06/2014 12.32.38,87.890366,72.014527,"Hello, Cindy Carson! You have 4 unread messages.",strawberry
5b5f3bd3b9abe1384c240d35,84,9d664f80-0ef-4044-94f9-c141c019e220,False,"$2,820.42",http://placehold.it/32x32,29,brown,Foley Moon,male,MEDICROIX,foleymoon@medicroix.com,+1 (801) 459-2618,"379 Dahill Road, Bainbridge, Nebraska, 7332","Esse adipisicing irure esse consectetur et mollit. Id irure non ullamco consectetur consequat ipsum sunt sit mollit consectetur qui. Amet laboris quis do voluptate excepteur laboris.
",10/01/2018 03.24.31,83.247187,-51.390596,"Hello, Foley Moon! You have 3 unread messages.",strawberry
5b5f3bd32e330f2fb5674440,85,c2ec55fe-b822-4efb-969f-65fceeef423e,True,"$3,303.39",http://placehold.it/32x32,21,green,Salas Wyatt,male,BEDDER,salaswyatt@bedder.com,+1 (945) 511-3063,"853 Glen Street, Gilgo, Tennessee, 7259","Eiusmod dolor nulla sit nisi cupidatat mollit minim Lorem enim. Quis quis nulla eiusmod ipsum elit eiusmod do. Quis incididunt do laborum occaecat id elit esse labore. Eu aliquip occaecat incididunt laboris cillum nisi. Nulla veniam consectetur qui excepteur occaecat sint velit voluptate minim sit sit elit.
",21/05/2017 11.43.07,-1.547394,-11.031078,"Hello, Salas Wyatt! You have 8 unread messages.",strawberry
5b5f3bd3f37be15e04670cf7,86,15fa448-bdd9-4419-9c69-5b2836041dd,False,"$1,750.98",http://placehold.it/32x32,28,brown,Dunlap Walton,male,WEBIOTIC,dunlapwalton@webiotic.com,+1 (982) 516-3771,"712 Dahlgreen Place, Kiskimere, Kansas, 2507","Qui reprehenderit proident veniam non culpa incididunt nostrud quis elit. Laborum proident eu consectetur Lorem pariatur aliqua irure qui fugiat deserunt ullamco. Et aute exercitation deserunt aliquip in pariatur. Voluptate duis mollit veniam ex ad qui proident commodo consequat non incididunt aliqua.
",25/08/2016 08.58.59,49.78754,-169.01967,"Hello, Dunlap Walton! You have 8 unread messages.",strawberry
5b5f3bd32601f5c9e3e5d773,87,bc1c4f8-e40-4653-91a6-acd4f36b59df,True,"$2,786.36",http://placehold.it/32x32,30,brown,Victoria Wallace,female,PORTALINE,victoriawallace@portaline.com,+1 (954) 429-3131,"846 Montieth Street, Farmers, Virginia, 7817","Exercitation irure cupidatat ex anim. Dolore sint dolore excepteur incididunt. Magna consequat sit minim eu consectetur ullamco amet amet ea irure.
",05/01/2017 06.46.18,81.55057,125.371711,"Hello, Victoria Wallace! You have 5 unread messages.",strawberry
5b5f3bd3e6976d9897fe01f4,88,fa324cd5-dcd2-45ce-a4ab-bd392db82aa1,False,"$2,949.67",http://placehold.it/32x32,24,blue,Nettie Cortez,female,GEOLOGIX,nettiecortez@geologix.com,+1 (840) 415-2896,"169 Stockholm Street, Calpine, New York, 8773","Incididunt adipisicing dolore commodo fugiat ut ea. Officia officia est fugiat aliqua deserunt ipsum officia do labore laboris est aliquip. Velit ad incididunt consectetur enim cupidatat sunt exercitation minim commodo culpa reprehenderit. Id reprehenderit incididunt nulla enim consectetur ad ad incididunt velit culpa nostrud. Amet consectetur deserunt laborum proident sunt sit consectetur pariatur enim duis ad dolore aliquip.
",05/12/2016 04.03.02,19.885901,12.760695,"Hello, Nettie Cortez! You have 10 unread messages.",banana
5b5f3bd3dc27247f58e4bf21,89,2d0af3-0a0-4cd-83a3-586b5c1350c,True,"$3,207.52",http://placehold.it/32x32,31,green,Darcy Whitley,female,LOTRON,darcywhitley@lotron.com,+1 (914) 494-3527,"153 Saratoga Avenue, Valle, South Carolina, 3704","Consectetur Lorem proident deserunt occaecat. Incididunt laborum ut labore velit ipsum minim. Deserunt incididunt voluptate incididunt cillum aliquip proident consequat. Occaecat sint est proident elit labore aute laboris irure aliquip mollit culpa. Qui nisi aliquip enim anim in reprehenderit. Cupidatat ea culpa nisi dolor nostrud consequat qui exercitation ullamco sit consequat irure.
",09/12/2015 07.34.37,-18.431947,-30.895764,"Hello, Darcy Whitley! You have 1 unread messages.",apple
5b5f3bd3948311a63d9cb590,90,153b96fa-196d-4ee-886f-04096d2cc4,False,"$2,156.94",http://placehold.it/32x32,37,blue,White Hopkins,male,EQUITAX,whitehopkins@equitax.com,+1 (993) 557-2590,"774 Furman Avenue, Belleview, New Mexico, 2647","Eu proident aliqua irure Lorem cupidatat id veniam est. Ipsum eiusmod commodo tempor magna esse enim tempor aliquip dolore. Enim exercitation do ex deserunt laborum aliqua. Labore sint reprehenderit qui minim ex ullamco qui. Adipisicing consequat enim esse duis ullamco ipsum nostrud et exercitation enim sunt est ut. Non Lorem minim dolore enim officia.
",23/12/2017 03.42.03,-17.00186,-81.384122,"Hello, White Hopkins! You have 2 unread messages.",strawberry
5b5f3bd31228f25ccb1ea627,91,02e3416-6366-4f31-8f1c-6b82a359a,True,"$1,482.57",http://placehold.it/32x32,27,blue,Landry Ortiz,male,RECRISYS,landryortiz@recrisys.com,+1 (800) 459-3903,"358 Gem Street, Olney, Florida, 6555","Qui ex occaecat excepteur pariatur Lorem sit cupidatat. Voluptate adipisicing officia tempor dolore et culpa Lorem et in aliqua sint consequat culpa enim. Excepteur laboris amet laborum sint Lorem consectetur nulla anim elit ad est aliqua anim sit. Elit ullamco mollit incididunt eu incididunt Lorem Lorem amet excepteur tempor pariatur occaecat. Elit incididunt dolor esse nisi voluptate. Ullamco minim non id ea Lorem sunt eiusmod sint aliquip sit enim ex elit. Dolore mollit est eiusmod minim dolore aliqua pariatur ipsum nostrud proident aliqua deserunt aliquip id.
",12/03/2016 06.55.17,2.914272,174.19447,"Hello, Landry Ortiz! You have 6 unread messages.",banana
5b5f3bd3118e9630b9a5191e,92,824ae43b-8a1b-4b9e-b90c-fc2df2144dd,True,"$1,380.87",http://placehold.it/32x32,27,green,Stuart Conley,male,VITRICOMP,stuartconley@vitricomp.com,+1 (865) 538-3377,"779 Chestnut Street, Tecolotito, Minnesota, 2779","Elit sit enim sunt irure Lorem sunt consequat incididunt labore duis sunt ad deserunt id. Id enim elit exercitation consectetur ad exercitation ut. Fugiat mollit dolore dolore cupidatat enim cillum velit. Non veniam et enim est veniam elit. Consectetur aute eu minim Lorem voluptate consequat ut eu nostrud magna ut. Qui tempor occaecat aliqua enim ea consequat magna consectetur aliquip laboris sit. Lorem voluptate minim qui sunt pariatur irure.
",11/06/2016 02.08.45,-56.95844,-163.727151,"Hello, Stuart Conley! You have 1 unread messages.",banana
5b5f3bd3aade3034081ce9f1,93,ffc53b19-399b-4098-8de1-4634028bc51,True,"$2,755.27",http://placehold.it/32x32,34,blue,Parrish Nichols,male,FUTURIZE,parrishnichols@futurize.com,+1 (817) 500-3153,"742 Victor Road, Graniteville, Maryland, 7069","Aliqua velit mollit et duis consectetur pariatur nisi anim qui minim proident deserunt. Occaecat Lorem incididunt culpa quis officia voluptate esse nisi veniam excepteur cupidatat in. Fugiat sit amet proident nostrud eiusmod reprehenderit cupidatat ullamco dolor adipisicing minim deserunt. Ut velit anim est reprehenderit irure ea consequat.
",20/07/2018 04.19.40,-60.641447,11.204623,"Hello, Parrish Nichols! You have 3 unread messages.",apple
5b5f3bd357b413bb8171bbd7,94,a984f6e3-fd2-4a6e-93cd-26d843265dc6,True,"$1,441.82",http://placehold.it/32x32,34,brown,Mcclure Hinton,male,FREAKIN,mcclurehinton@freakin.com,+1 (887) 452-3128,"244 Doone Court, Cornucopia, Maine, 9126","Reprehenderit deserunt qui excepteur ad aute laboris. Sint adipisicing veniam aute magna. Proident dolor qui sint sunt labore culpa ea commodo sit. Aliqua quis cillum ad occaecat cillum. Veniam ullamco ad veniam ex aliquip. Culpa quis do ullamco fugiat. Excepteur ex excepteur et veniam est nulla ipsum ut sit veniam.
",13/09/2017 02.51.56,14.378734,-124.541248,"Hello, Mcclure Hinton! You have 3 unread messages.",strawberry
5b5f3bd33249061a96389f67,95,31d04a8d-f2c1-444d-a3cc-1b26235f6186,True,"$1,079.61",http://placehold.it/32x32,20,brown,Underwood Gross,male,TROPOLI,underwoodgross@tropoli.com,+1 (941) 555-3640,"395 Vanderbilt Street, Hachita, Massachusetts, 1850","Nisi aliqua laborum ipsum consequat laborum esse veniam cillum laborum ea tempor qui. Ut dolore aliquip et quis reprehenderit quis ullamco sit labore est mollit et aliqua ullamco. Occaecat amet eiusmod cillum mollit excepteur. Labore culpa fugiat nostrud do enim veniam duis magna. Excepteur proident laborum quis sunt minim. Dolor quis mollit cupidatat occaecat minim Lorem. Ipsum ad exercitation cillum excepteur ullamco mollit.
",08/03/2017 10.30.03,84.213845,-32.104394,"Hello, Underwood Gross! You have 10 unread messages.",strawberry
5b5f3bd3e8055e1b39912478,96,06142460-69-4068-8f25-4bb33cd6143,False,"$2,368.65",http://placehold.it/32x32,29,blue,Waller Ramsey,male,ORBIFLEX,wallerramsey@orbiflex.com,+1 (878) 527-3538,"271 Doscher Street, Davenport, Northern Mariana Islands, 5967","Consectetur adipisicing ullamco minim irure. Non dolore et dolore officia proident ea ex et in adipisicing nisi aliqua. Amet mollit cillum dolore officia dolore elit est magna. Ut in ipsum labore labore mollit.
",25/07/2014 05.07.36,-29.668128,-77.728975,"Hello, Waller Ramsey! You have 3 unread messages.",banana
5b5f3bd372f86c4f92326a4a,97,d595580-b088-4242-bfd8-8219128b182c,True,"$2,679.41",http://placehold.it/32x32,39,green,Vasquez Orr,male,SIGNIDYNE,vasquezorr@signidyne.com,+1 (980) 532-3959,"649 Ridgewood Avenue, Websterville, Idaho, 5625","Aute reprehenderit sit duis aliquip sint cupidatat ullamco nostrud esse aliquip sit. Occaecat culpa consectetur aliquip eiusmod tempor ad ad exercitation incididunt non. Fugiat esse amet incididunt quis fugiat ullamco deserunt magna in ut magna ut. Tempor commodo ut irure elit occaecat. Ullamco occaecat et amet occaecat nisi cupidatat reprehenderit commodo incididunt laborum labore officia cillum duis. Consequat sint consectetur laborum voluptate consectetur ea ad quis aute. Labore eiusmod enim culpa cillum sint proident sunt ex.
",05/03/2015 07.11.54,78.238911,21.90904,"Hello, Vasquez Orr! You have 4 unread messages.",strawberry
5b5f3bd3a6deb7ee499b61f6,98,db2b3b6e-c6e2-42aa-ad3c-334bcc82859,True,"$3,766.97",http://placehold.it/32x32,26,green,Gracie Velasquez,female,TROPOLIS,gracievelasquez@tropolis.com,+1 (843) 407-2835,"754 Ide Court, Cazadero, Ohio, 5760","Consequat quis eiusmod ullamco reprehenderit irure laborum esse tempor tempor. Consectetur consectetur quis enim non duis quis dolor. Ullamco eu consequat elit fugiat quis labore ex est quis ex labore excepteur ullamco. Ipsum magna nisi consequat commodo minim ea cupidatat officia nostrud. Ut excepteur cillum Lorem ullamco minim. Est sunt excepteur laborum sint consectetur ex eiusmod esse. Nostrud amet tempor commodo Lorem commodo ex adipisicing fugiat commodo.
",14/03/2015 06.26.15,-59.118588,-56.651983,"Hello, Gracie Velasquez! You have 4 unread messages.",banana
5b5f3bd3500147591b4ad5b5,99,09bbea32-f45d-458b-9b96-f0820cb935,True,"$1,663.19",http://placehold.it/32x32,36,brown,Shanna Sparks,female,PORTICA,shannasparks@portica.com,+1 (970) 466-3628,"433 Seacoast Terrace, Lopezo, South Dakota, 8343","Reprehenderit voluptate consectetur id ex et cupidatat consequat tempor Lorem eiusmod. Mollit aliquip qui ea commodo Lorem dolor deserunt adipisicing dolor cillum nulla ex. Occaecat ut minim elit pariatur nulla occaecat occaecat est laboris incididunt est exercitation in proident. Ex ea ea eu laboris laborum enim consectetur minim deserunt mollit.
",19/06/2016 03.32.09,25.879448,-34.257873,"Hello, Shanna Sparks! You have 1 unread messages.",apple
