_id,index,guid,isActive,balance,picture,age,eyeColor,name,gender,company,email,phone,address,about,registered,latitude,longitude,greeting,favoriteFruit
5b5f3bd340cdf6806346b3ef,0,b2af2ad2-c6e1-4e81-94ae-5b4ac185c9df,False,"$3,613.61",http://placehold.it/32x32,29,brown,Myrna Davis,female,MYOPIUM,myrnadavis@myopium.com,+1 (952) 510-2371,"331 Stryker Street, Harold, Nevada, 1732","Ex Lorem laboris veniam sunt in veniam commodo laboris deserunt exercitation aute consequat irure. Ex laborum ea proident cillum incididunt exercitation deserunt reprehenderit. Aute deserunt minim ex do incididunt exercitation laboris ut pariatur ipsum cupidatat do. Ut in anim dolor irure irure consequat magna duis consequat labore. Mollit cillum consequat proident est dolore. Eiusmod nisi nisi non aliqua ea dolore laboris exercitation commodo incididunt irure. Voluptate nostrud magna veniam tempor Lorem consectetur ullamco sit ut occaecat id.
",02/05/2016 10.57.17,-11.069287,79.725586,"Hello, Myrna Davis! You have 2 unread messages.",banana
5b5f3bd36b43daa0d1d62bcb,1,0298584-6a0f-402c-bbeb-f03a3b9e4126,False,"$2,978.35",http://placehold.it/32x32,28,green,Holloway Humphrey,male,GLASSTEP,hollowayhumphrey@glasstep.com,+1 (945) 475-3330,"515 Mersereau Court, Blandburg, Palau, 4788","Excepteur mollit minim enim proident. Ea minim magna ad sit irure ex cillum sint proident qui adipisicing dolore anim sit. Aliquip pariatur ut consectetur dolor.
",13/05/2016 08.29.45,-62.890792,33.629095,"Hello, Holloway Humphrey! You have 1 unread messages.",apple
5b5f3bd33c4a4268052e0e32,2,e4ee6e-995a-4fa1-8e4-539c52045a9,True,"$3,709.53",http://placehold.it/32x32,32,blue,Fran Kane,female,VISUALIX,frankane@visualix.com,+1 (866) 494-2940,"194 Garden Place, Bangor, Hawaii, 7146","Tempor ullamco dolore proident ad eu occaecat eiusmod proident voluptate. Qui proident mollit ut cillum Lorem excepteur ad minim ad enim cillum Lorem veniam pariatur. Duis aute occaecat labore ut deserunt elit ea reprehenderit ex veniam velit. Tempor cillum Lorem aliqua aute aute excepteur. Incididunt ut labore fugiat sit do ut sit incididunt minim id deserunt ea duis. Minim qui in tempor eiusmod. Dolore aliqua labore quis laborum qui nostrud.
",13/02/2016 10.48.39,43.546945,-83.251194,"Hello, Fran Kane! You have 2 unread messages.",apple
5b5f3bd3593657fdccab2f94,3,08f95835-d660-4a90-9c1-435dca0e3ff,False,"$2,646.32",http://placehold.it/32x32,26,brown,Estela Harris,female,ZYTREK,estelaharris@zytrek.com,+1 (909) 559-3071,"171 Nolans Lane, Winesburg, Oklahoma, 6053","Et nulla aute eiusmod fugiat qui. Lorem anim ullamco laboris aliqua culpa incididunt consequat ea quis. Do eu fugiat esse aliqua esse commodo. Voluptate deserunt non nulla voluptate.
",01/08/2016 02.15.58,8.034217,-158.826622,"Hello, Estela Harris! You have 10 unread messages.",strawberry
5b5f3bd308de6173d2f93461,4,28228d9-a9c3-400-9101-c251c08544,False,"$1,091.72",http://placehold.it/32x32,22,brown,Richards Nicholson,male,BIOSPAN,richardsnicholson@biospan.com,+1 (865) 523-3851,"647 Withers Street, Manila, New Hampshire, 1674","Dolore cupidatat mollit elit commodo enim minim veniam laboris enim. Amet cupidatat id laborum do tempor id sunt veniam nostrud veniam incididunt aliquip incididunt. Ipsum veniam consectetur ipsum minim elit eiusmod eiusmod aliqua esse quis cupidatat duis aliqua cupidatat. Eu in laborum enim proident duis sit laboris commodo et exercitation sunt qui irure et.
",12/09/2016 06.31.14,33.164263,12.347101,"Hello, Richards Nicholson! You have 2 unread messages.",apple
5b5f3bd3ce1f1cbac394d99d,5,6923f063-dd32-4c4d-94d-09b45836c102,False,"$2,206.86",http://placehold.it/32x32,34,brown,Jean Cline,female,TECHADE,jeancline@techade.com,+1 (983) 526-3236,"167 Bergen Court, Mapletown, Washington, 4667","Ea cillum dolor do laboris in do mollit deserunt officia aliqua id. Anim velit occaecat sunt occaecat dolore consequat nulla non do voluptate est. Cillum tempor incididunt tempor amet nisi ea duis.
",20/06/2016 10.41.04,84.461666,165.392205,"Hello, Jean Cline! You have 6 unread messages.",apple
5b5f3bd3b3955f894aeb248f,6,bd5894a1-c0d6-435d-95-335f25e116,False,"$3,549.13",http://placehold.it/32x32,22,brown,Hopper Diaz,male,MOREGANIC,hopperdiaz@moreganic.com,+1 (992) 489-3004,"970 Grand Street, Hayes, Mississippi, 2347","Aliquip esse tempor incididunt irure veniam voluptate elit tempor voluptate do. Consequat sit eiusmod eu proident consequat. Elit voluptate pariatur labore sunt sit nostrud sint incididunt. In ullamco sit culpa laborum nulla eiusmod Lorem sunt qui enim id. Exercitation amet velit sunt duis et elit. Occaecat consectetur id ut commodo duis adipisicing elit aliquip dolor id anim esse. Duis qui commodo do incididunt reprehenderit magna consectetur quis excepteur.
",17/05/2016 09.04.05,-83.938223,49.65483,"Hello, Hopper Diaz! You have 8 unread messages.",apple
5b5f3bd3b8bac9ffdd18fa94,7,a40cffa4-5102-4eee-8bbd-b8b5498f54,False,"$3,599.10",http://placehold.it/32x32,30,blue,Morrow Russo,male,ZENSURE,morrowrusso@zensure.com,+1 (942) 508-2034,"404 Moffat Street, Caln, Delaware, 2236","Qui aliquip tempor non excepteur excepteur aute cillum voluptate in reprehenderit deserunt exercitation sit qui. Irure deserunt ad id reprehenderit eu non occaecat incididunt veniam consectetur aliquip. Ea cupidatat anim culpa sunt quis consequat consequat fugiat veniam enim esse. Ipsum magna ipsum veniam sunt adipisicing duis nisi. Aliquip aute mollit nulla ad nulla magna et culpa veniam voluptate. In nostrud cillum ex tempor anim exercitation irure do amet labore eu. Cupidatat ut ipsum dolor voluptate deserunt eiusmod irure.
",14/06/2016 12.50.42,-55.581551,-0.5224,"Hello, Morrow Russo! You have 1 unread messages.",banana
5b5f3bd396f22d8277adb9a4,8,50ad9ad2-a65-4bf5-9b9d-9d25be3c66e0,False,"$2,994.19",http://placehold.it/32x32,32,brown,Gill Casey,male,ROCKLOGIC,gillcasey@rocklogic.com,+1 (908) 582-2369,"166 Olive Street, Munjor, Puerto Rico, 9972","Cupidatat amet proident cupidatat officia ipsum nulla anim ea id cupidatat cupidatat quis esse nulla. Id anim sint exercitation velit. Irure sit veniam id excepteur anim magna non eu est sunt. Dolor pariatur aliqua aliquip elit anim dolor pariatur consectetur nulla laboris do enim.
",21/06/2016 01.50.21,34.154316,145.363239,"Hello, Gill Casey! You have 5 unread messages.",apple
5b5f3bd3fc9920d1a190aca4,9,0d23d5c9-9342-49b8-b0eb-da2b530fed8,False,"$3,767.35",http://placehold.it/32x32,40,brown,Alvarez Everett,male,AVIT,alvarezeverett@avit.com,+1 (891) 403-2947,"615 Pierrepont Street, Mulberry, North Carolina, 1757","Aute velit reprehenderit deserunt voluptate aute. Do amet duis sint eiusmod velit ad consequat. Non ad ea proident proident cupidatat excepteur cupidatat dolore. Fugiat et quis pariatur proident consectetur sint cupidatat sint. Nostrud incididunt incididunt ipsum ullamco velit anim laboris sunt proident excepteur magna anim.
",27/10/2014 05.27.38,64.24,124.958447,"Hello, Alvarez Everett! You have 10 unread messages.",strawberry
5b5f3bd3df956cb58ea4f761,10,edca2cb-b94-4e24-a9d6-1ff4658c0001,True,"$1,438.75",http://placehold.it/32x32,40,brown,Chasity Melendez,female,PODUNK,chasitymelendez@podunk.com,+1 (882) 459-2199,"916 Moore Street, Klondike, Guam, 8613","Ea nisi laboris enim adipisicing labore labore esse tempor. Ipsum elit consectetur sint anim. Occaecat esse ut enim excepteur minim esse consequat esse anim aliquip. Sit fugiat amet amet labore tempor ea in veniam occaecat cupidatat magna minim. Enim est amet veniam cupidatat aliquip officia ullamco consequat ut amet ut. Proident laborum sint id incididunt est amet sit Lorem officia irure proident mollit sunt.
",10/12/2016 10.58.11,42.84521,-68.046628,"Hello, Chasity Melendez! You have 5 unread messages.",banana
5b5f3bd3f11161ee163437ca,11,5660d6fe-ed09-49c8-8558-fe24f8da,False,"$2,034.18",http://placehold.it/32x32,27,green,Olive Oneal,female,SENTIA,oliveoneal@sentia.com,+1 (890) 465-3948,"341 Townsend Street, Madrid, Wisconsin, 7343","Velit nisi eiusmod sit et veniam. Sint aliquip et occaecat id veniam aliquip tempor eiusmod duis mollit quis laboris. Duis reprehenderit ipsum ad aliqua voluptate culpa elit. Id ea magna enim sunt tempor proident velit laboris nostrud. Velit voluptate aliquip labore aliquip ea ullamco fugiat anim eiusmod irure aute occaecat esse. Dolore aliquip in commodo Lorem anim pariatur et nisi occaecat laboris reprehenderit ut irure.
",17/06/2014 03.35.08,38.429224,-159.260608,"Hello, Olive Oneal! You have 2 unread messages.",banana
5b5f3bd3dca9937257804517,12,2af3ddf9-2d2d-424b-bff5-0a19b2955950,True,"$2,110.20",http://placehold.it/32x32,26,green,Juliana Brennan,female,STREZZO,julianabrennan@strezzo.com,+1 (908) 434-2615,"829 Bokee Court, Bradenville, Indiana, 9108","Consectetur ad ea incididunt laboris nostrud aliqua et deserunt. Minim dolore veniam consectetur mollit aute eu non fugiat veniam ullamco mollit deserunt. Minim magna exercitation nisi proident irure. Ut voluptate qui amet ex deserunt ut laboris voluptate cupidatat do est cupidatat.
",06/10/2015 08.16.41,56.452812,160.787069,"Hello, Juliana Brennan! You have 4 unread messages.",banana
5b5f3bd35e59b2f3c83c9868,13,e458151e-341a-4455-af20-f82cbfc6f26a,True,"$3,066.97",http://placehold.it/32x32,31,blue,Lloyd Allison,male,KLUGGER,lloydallison@klugger.com,+1 (801) 590-3288,"632 Dinsmore Place, Dahlen, Vermont, 9286","Eu et est mollit officia aliqua. Id culpa id et aliqua voluptate eiusmod dolor consequat. Exercitation excepteur irure esse mollit duis cillum esse amet commodo. Mollit consectetur ex incididunt proident proident commodo id et in commodo officia. Nostrud esse irure nulla aute. Culpa culpa aute labore ullamco ullamco anim magna. Commodo voluptate elit est enim ad ullamco.
",16/05/2014 02.35.00,-50.411488,50.60853,"Hello, Lloyd Allison! You have 10 unread messages.",strawberry
5b5f3bd3a72869359ace8a2a,14,e0eed489-fdde-4a91-99f-5b2d5f185eed,False,"$2,508.31",http://placehold.it/32x32,22,brown,Tanner Bender,male,KINDALOO,tannerbender@kindaloo.com,+1 (809) 544-3864,"124 Empire Boulevard, Leland, Texas, 5202","Labore laborum ex id cupidatat esse. Sit ad non deserunt incididunt ex deserunt. Eu amet excepteur est sit dolor. Ex proident incididunt cillum qui voluptate qui labore. Occaecat quis cupidatat sunt duis nulla culpa labore incididunt eiusmod reprehenderit. Do ut reprehenderit aute occaecat culpa laborum duis dolore labore veniam. Ullamco veniam duis sunt exercitation ipsum veniam.
",21/11/2014 04.47.26,-15.6959,-170.274456,"Hello, Tanner Bender! You have 8 unread messages.",strawberry
5b5f3bd3830cdb5d79f3a999,15,11481a3-f34d-4ca3-834f-c52ab0a3ad34,True,"$3,112.68",http://placehold.it/32x32,38,green,Fernandez Jarvis,male,EXTRO,fernandezjarvis@extro.com,+1 (961) 511-2925,"355 Seigel Street, Beechmont, Alabama, 8614","Proident dolor aliqua laborum deserunt ex do cillum commodo labore fugiat aliquip sunt. Aute mollit elit pariatur do enim laboris dolor labore adipisicing. Deserunt qui culpa enim consectetur amet adipisicing laborum duis ut fugiat irure duis. Nisi aliquip commodo minim in sit aute in ut.
",04/03/2017 04.52.00,67.993827,30.333066,"Hello, Fernandez Jarvis! You have 9 unread messages.",apple
5b5f3bd384d91a3beca8b452,16,a3f502f-4a53-4b05-bda4-4634c11c165,True,"$2,496.16",http://placehold.it/32x32,29,brown,Bender Booth,male,COMVERGES,benderbooth@comverges.com,+1 (964) 515-2997,"106 Orange Street, Nanafalia, Louisiana, 1678","Irure qui officia exercitation deserunt est aliqua nisi. Proident quis nulla veniam ut officia ex ullamco aliquip. Sunt veniam eu aliqua dolor esse qui pariatur Lorem aute ullamco ullamco proident non consectetur.
",14/07/2015 06.24.03,-11.167346,55.021741,"Hello, Bender Booth! You have 1 unread messages.",strawberry
5b5f3bd33db664bdc82df1a4,17,85d99166-9b05-4bae-90d2-05c59833b4fe,False,"$1,376.78",http://placehold.it/32x32,30,green,Linda Cummings,female,RODEOCEAN,lindacummings@rodeocean.com,+1 (804) 408-3988,"135 Vermont Court, Fedora, Virgin Islands, 4152","Magna voluptate magna Lorem ea. Aliqua dolore eiusmod ut consequat ad occaecat labore eu est nisi sit mollit. Minim ipsum nostrud nostrud ut sunt velit ipsum est ea pariatur aliquip.
",25/11/2017 12.59.40,78.399848,-7.118202,"Hello, Linda Cummings! You have 5 unread messages.",apple
5b5f3bd34eaae47e07647219,18,9d5e4e84-9805-4101-9696-dfd0b5813a,True,"$1,787.39",http://placehold.it/32x32,38,green,Stephanie Hahn,female,NETAGY,stephaniehahn@netagy.com,+1 (997) 494-3932,"344 Vandervoort Place, Forbestown, Missouri, 4002","Quis aute commodo consequat ea aliquip anim aliqua voluptate sint officia mollit quis ad. In laborum nulla ipsum nostrud veniam voluptate id sit dolor. Nisi id velit pariatur deserunt labore culpa ullamco excepteur sunt ea quis mollit voluptate mollit. Consequat et ut excepteur dolor velit est ullamco velit exercitation elit anim. Nostrud aute proident occaecat ipsum laboris sint excepteur amet veniam. Occaecat minim consectetur est voluptate qui et in laboris enim nostrud. Consequat aliqua adipisicing amet ipsum nulla nostrud ut ipsum sint nostrud.
",07/11/2017 04.28.06,-33.517825,-45.434909,"Hello, Stephanie Hahn! You have 2 unread messages.",strawberry
5b5f3bd362fe3f318c05321d,19,fc942329-c8c9-4a1f-9f1f-b0dd4c4b9bbf,False,"$2,890.63",http://placehold.it/32x32,40,brown,Nolan Torres,male,INEAR,nolantorres@inear.com,+1 (888) 448-3103,"867 Hope Street, Stagecoach, Rhode Island, 4982","Nisi occaecat magna duis ut et ullamco anim esse occaecat cupidatat sint excepteur ullamco labore. Laboris laboris ipsum nostrud dolor in quis mollit. Amet in officia velit pariatur in.
",24/06/2014 02.13.25,-4.665919,119.189936,"Hello, Nolan Torres! You have 4 unread messages.",apple
5b5f3bd3c1cc61489ab96677,20,81b651-9f6e-411a-8f9-196e9b25e2,True,"$3,557.94",http://placehold.it/32x32,23,green,Nancy Webb,female,ZOLAREX,nancywebb@zolarex.com,+1 (819) 490-3951,"194 Kiely Place, Foscoe, Pennsylvania, 770","Aute fugiat esse duis occaecat eiusmod eiusmod pariatur nulla est exercitation nisi laboris et. Lorem consequat qui voluptate in. Nisi adipisicing nisi sit magna nisi consequat anim esse cupidatat ullamco in ea laboris ex. Pariatur mollit ullamco minim in dolor ea. Aute do enim veniam laboris culpa excepteur. Eiusmod voluptate est laboris anim ipsum duis non veniam consectetur.
",19/05/2016 04.12.17,22.866034,-11.375139,"Hello, Nancy Webb! You have 5 unread messages.",apple
5b5f3bd3e2bd248136847130,21,08a41214-2dc6-42a4-aa9e-30dbd459f95,True,"$1,947.35",http://placehold.it/32x32,28,green,Fanny Fox,female,PROXSOFT,fannyfox@proxsoft.com,+1 (906) 425-2083,"357 Story Street, Tivoli, Connecticut, 2831","Aliqua ut commodo aliqua minim exercitation deserunt qui reprehenderit veniam eu dolor. Dolor laborum cillum reprehenderit ea excepteur ullamco cupidatat elit veniam. Ex do officia nulla eiusmod. Cillum officia magna exercitation consequat pariatur consequat elit ad.
",15/04/2015 09.00.49,-69.39981,0.22677,"Hello, Fanny Fox! You have 3 unread messages.",strawberry
5b5f3bd32578d00b28ab9afe,22,f428f5d-f01-4854-9135-205a43698ad9,False,"$3,481.30",http://placehold.it/32x32,34,brown,Ingrid Mcdaniel,female,CALCULA,ingridmcdaniel@calcula.com,+1 (842) 430-3145,"236 Eastern Parkway, Greensburg, Illinois, 8783","Adipisicing laborum aliqua et labore nulla eu adipisicing adipisicing veniam ipsum ullamco irure. Ea incididunt duis ipsum nisi duis minim elit laborum duis. Nulla fugiat enim excepteur occaecat aute qui adipisicing elit culpa elit minim. Tempor minim et eiusmod eiusmod minim enim enim culpa. Non minim culpa fugiat nostrud pariatur pariatur commodo eiusmod dolor anim officia sint quis. Ullamco reprehenderit duis consectetur sunt enim. Commodo laborum et esse ea anim adipisicing aute sint ad.
",03/09/2015 04.42.46,83.658313,-174.401452,"Hello, Ingrid Mcdaniel! You have 1 unread messages.",banana
5b5f3bd37f612079c35036a4,23,460089f2-9196-4a45-94a9-9ad0623143c,True,"$3,130.10",http://placehold.it/32x32,34,brown,Kathrine Blanchard,female,ZANITY,kathrineblanchard@zanity.com,+1 (877) 457-2951,"396 Havemeyer Street, Hessville, Federated States Of Micronesia, 5375","Adipisicing eu in eiusmod consequat mollit elit ut sunt. Minim esse quis adipisicing aute Lorem officia non. Enim dolore aute in irure exercitation tempor do pariatur aliqua. Minim voluptate incididunt do proident. Commodo officia labore ad et ad aliqua ex magna non magna quis sint minim. Nulla Lorem minim exercitation ipsum sunt duis dolor occaecat. Non commodo consectetur ullamco reprehenderit nisi fugiat dolore excepteur et et sit tempor magna.
",09/06/2015 08.01.11,-7.40581,-117.861042,"Hello, Kathrine Blanchard! You have 10 unread messages.",strawberry
5b5f3bd3ebc3b2d0454716ef,24,da842c53-94d6-4b9e-a6fe-ffd12024696,False,"$1,723.44",http://placehold.it/32x32,22,blue,Wanda Mathis,female,BIZMATIC,wandamathis@bizmatic.com,+1 (844) 517-2255,"717 Bijou Avenue, Kapowsin, Wyoming, 5781","Officia culpa aliqua eiusmod et ex non amet. Elit qui incididunt ullamco aliquip amet id deserunt consectetur laborum id irure ullamco voluptate. Occaecat in ut cupidatat cupidatat ad veniam voluptate dolore est officia non. In ullamco Lorem culpa mollit Lorem culpa Lorem proident eu ut nulla esse exercitation.
",22/01/2015 05.13.36,-3.355966,17.730929,"Hello, Wanda Mathis! You have 3 unread messages.",apple
5b5f3bd3b856ceeec5723a3d,25,5d1c0e61-468-45b6-8189-9fd990ac6d9,False,"$2,803.50",http://placehold.it/32x32,39,brown,Winters Beasley,male,KANGLE,wintersbeasley@kangle.com,+1 (895) 596-3635,"551 Monroe Place, Floriston, Kentucky, 3209","Amet duis deserunt cupidatat quis voluptate cillum ex voluptate ipsum. Nulla veniam minim elit elit non. Adipisicing qui nulla magna nisi incididunt magna officia deserunt exercitation ullamco minim veniam occaecat.
",14/03/2014 11.09.46,17.087696,-73.944323,"Hello, Winters Beasley! You have 10 unread messages.",strawberry
5b5f3bd3b2376ae8f233856b,26,bffabc5b-c629-4ac0-9c92-acf9065a4,True,"$2,628.79",http://placehold.it/32x32,35,brown,Muriel Osborne,female,ZBOO,murielosborne@zboo.com,+1 (982) 409-2203,"899 Independence Avenue, Nipinnawasee, Nebraska, 3779","Esse enim Lorem duis minim labore magna aliquip ea minim do aute. Labore nostrud excepteur sit tempor dolor duis fugiat adipisicing esse. Adipisicing elit laboris adipisicing nostrud nisi est tempor esse quis officia excepteur tempor. Labore eiusmod officia aliqua occaecat in sunt. Anim consequat adipisicing cupidatat non velit cillum exercitation adipisicing sint.
",17/04/2016 07.25.34,39.895233,-136.774743,"Hello, Muriel Osborne! You have 1 unread messages.",banana
5b5f3bd3376bc6ff9e841179,27,adce1e38-6989-421-99d2-4bfc29a2c892,False,"$2,039.31",http://placehold.it/32x32,29,green,Rowe Ingram,male,CODACT,roweingram@codact.com,+1 (905) 544-2764,"600 Fulton Street, Terlingua, Tennessee, 4238","Nostrud culpa Lorem enim laboris incididunt labore fugiat minim do. Dolor consequat do et culpa duis aliquip eu anim ea sit eiusmod fugiat anim. Adipisicing cillum incididunt laboris ullamco anim laboris cupidatat amet esse. Officia labore velit ea do fugiat nulla officia ullamco laboris mollit ut. Do consectetur fugiat sit magna deserunt amet mollit quis ut. Nulla exercitation labore irure ut ex duis commodo cillum cupidatat consectetur deserunt commodo consectetur aliqua.
",31/03/2014 09.22.37,64.518436,-128.906429,"Hello, Rowe Ingram! You have 2 unread messages.",banana
5b5f3bd33332a0671e9b54c5,28,64fa233b-218b-4d10-b82e-9cd4f641c533,True,"$2,165.19",http://placehold.it/32x32,26,green,Montgomery Schultz,male,WATERBABY,montgomeryschultz@waterbaby.com,+1 (833) 591-2131,"193 Madison Place, Bison, Kansas, 9168","Eu eu sint exercitation ea. In qui sit consectetur nostrud tempor culpa. Quis id adipisicing adipisicing ea laborum. Nisi sit velit laboris laboris reprehenderit sunt excepteur nostrud et do fugiat laborum et adipisicing.
",14/08/2015 12.35.02,-56.456081,-31.980087,"Hello, Montgomery Schultz! You have 2 unread messages.",apple
5b5f3bd3bb47256aeeebe1fb,29,feedd0-8a84-4b0c-8abe-9ed95baccec,True,"$3,453.46",http://placehold.it/32x32,21,green,Reilly Lara,male,PHOLIO,reillylara@pholio.com,+1 (964) 597-2408,"552 Lewis Avenue, Enlow, Virginia, 6383","Magna enim eu anim consequat quis anim incididunt culpa fugiat sit magna. Ullamco consequat excepteur elit ullamco elit aliquip velit elit dolore. Anim exercitation dolore ut aliqua quis occaecat. In esse reprehenderit aliquip do reprehenderit. Aute non anim culpa reprehenderit est magna dolore Lorem cillum non quis incididunt commodo fugiat. Anim laboris ea labore enim esse aliquip eiusmod culpa. Mollit fugiat elit est dolore esse laborum sit sit.
",08/08/2017 08.21.55,-0.257711,121.80419,"Hello, Reilly Lara! You have 7 unread messages.",apple
5b5f3bd3842b4ba587970885,30,594e3e39-e5fb-40fc-815e-61690be8b641,False,"$2,772.48",http://placehold.it/32x32,26,green,Webster Ratliff,male,COMBOT,websterratliff@combot.com,+1 (896) 441-2284,"120 Erasmus Street, Defiance, New York, 5666","Ea duis minim veniam nisi esse. Sunt deserunt ad exercitation aliqua. Ut eu dolore labore ex est occaecat. Sint culpa in id eu eiusmod dolor non.
",03/06/2015 11.53.54,7.238297,-32.979815,"Hello, Webster Ratliff! You have 3 unread messages.",strawberry
5b5f3bd3fc48dcb04d7196b9,31,a16eb1b-be30-44ba-a12b-00fc35e4df9a,False,"$2,590.87",http://placehold.it/32x32,22,green,Wilkins Mccoy,male,PULZE,wilkinsmccoy@pulze.com,+1 (968) 479-2260,"353 Hinckley Place, Ebro, South Carolina, 3253","Exercitation aliqua amet commodo nisi exercitation amet laboris cupidatat sunt fugiat occaecat anim cillum incididunt. Nulla voluptate sunt ullamco aute veniam irure ullamco sit velit. Labore reprehenderit magna sit duis eiusmod magna adipisicing laboris. Cillum cillum duis nostrud non.
",11/07/2018 12.50.05,-82.266042,-0.373938,"Hello, Wilkins Mccoy! You have 2 unread messages.",strawberry
5b5f3bd39fed1d7f3dbfc51f,32,99962cd-85f-4643-a602-5b836e9a129,False,"$1,525.17",http://placehold.it/32x32,25,blue,Stone Moreno,male,COMTOUR,stonemoreno@comtour.com,+1 (910) 464-2212,"940 Utica Avenue, Camptown, New Mexico, 3905","Eiusmod dolore nulla velit anim tempor minim voluptate. Sit officia elit nisi exercitation laborum consequat elit pariatur pariatur excepteur in ex. Eu ut ea mollit commodo duis consequat sunt. Ut elit aliqua eu duis mollit pariatur aliquip velit fugiat irure nostrud consequat culpa elit. Duis consectetur veniam ea laboris eiusmod sit culpa consequat ex anim ut sit.
",22/11/2015 04.13.46,23.954533,71.756002,"Hello, Stone Moreno! You have 4 unread messages.",banana
5b5f3bd3b943a21f26ba27a2,33,bbd12843-6a1a-4f9-93db-a6da1d89daaa,False,"$3,245.44",http://placehold.it/32x32,35,brown,Kirk Solomon,male,UPDAT,kirksolomon@updat.com,+1 (976) 550-3025,"554 Garnet Street, Ernstville, Florida, 2849","Commodo ex dolore amet enim deserunt occaecat culpa fugiat eu minim ea. Eu anim ut cupidatat proident consectetur do. Irure nostrud fugiat minim deserunt enim et dolore ut ad laborum. Enim ex elit dolore et ullamco mollit laborum pariatur cillum.
",27/03/2014 08.51.42,-23.821883,10.810277,"Hello, Kirk Solomon! You have 1 unread messages.",apple
5b5f3bd36ab6929d7cebfa72,34,32f6ff6c-8e59-46fc-9569-cf85b5dfb25f,True,"$1,186.80",http://placehold.it/32x32,37,blue,Amber Koch,female,ANDERSHUN,amberkoch@andershun.com,+1 (970) 476-2770,"519 Stoddard Place, Keyport, Minnesota, 1145","Labore aliquip cupidatat amet incididunt. Ipsum amet duis ex cupidatat elit laboris laboris ad dolore cillum Lorem amet. Et enim consectetur sunt cupidatat occaecat eu ut irure non Lorem reprehenderit exercitation.
",06/03/2018 07.36.05,62.498844,-73.803319,"Hello, Amber Koch! You have 5 unread messages.",apple
5b5f3bd359b2fab29d75b02c,35,a30c2bf4-2ae1-45ae-be3f-82eafefdd20a,False,"$1,960.49",http://placehold.it/32x32,39,green,Pearson Harding,male,MUSAPHICS,pearsonharding@musaphics.com,+1 (987) 474-3220,"449 Gelston Avenue, Enoree, Maryland, 2585","Consectetur tempor ullamco quis adipisicing ea labore culpa ea ullamco qui ea incididunt. Nostrud Lorem ea anim officia proident pariatur proident fugiat occaecat. Est nulla deserunt do irure adipisicing cillum cupidatat pariatur qui minim cillum id est. Labore Lorem aute cupidatat velit eiusmod mollit laborum elit nostrud. Aliquip magna cupidatat veniam reprehenderit occaecat laboris cupidatat cillum cillum sint duis reprehenderit anim. Sint eiusmod deserunt aliqua ea nisi. Proident fugiat exercitation nulla pariatur ea officia sunt eu velit qui laboris ullamco.
",28/01/2018 03.16.43,83.220109,33.913009,"Hello, Pearson Harding! You have 6 unread messages.",strawberry
5b5f3bd34c8db076cb6ea627,36,a03c60bd-8c4-4506-9e96-dfbab8b9f0ce,True,"$2,887.71",http://placehold.it/32x32,37,green,Ada Sloan,female,SYBIXTEX,adasloan@sybixtex.com,+1 (968) 486-2621,"160 Oceanview Avenue, Ellerslie, Maine, 4113","Ea irure ex ullamco culpa deserunt occaecat ad. Culpa consequat aliqua esse cillum occaecat culpa do ea ea cupidatat nostrud incididunt quis labore. Sit consectetur laboris aliquip pariatur pariatur cillum id proident.
",31/03/2018 12.27.43,66.904855,20.473991,"Hello, Ada Sloan! You have 8 unread messages.",apple
5b5f3bd379a30aa195b222c0,37,e0b8829-381-44be-960-c019a8b9c0ae,False,"$3,643.86",http://placehold.it/32x32,28,green,Velasquez Cole,male,COLUMELLA,velasquezcole@columella.com,+1 (809) 403-2248,"614 Stockton Street, Sanborn, Massachusetts, 6548","Sunt excepteur do deserunt ipsum fugiat Lorem dolore sint aliqua sunt ad duis. Aute consequat ut est ipsum labore in Lorem aute Lorem reprehenderit. Cupidatat quis officia excepteur duis velit voluptate sint. Laborum minim deserunt et cillum qui sint ipsum sint veniam mollit.
",25/05/2017 06.57.51,21.202193,-167.319361,"Hello, Velasquez Cole! You have 5 unread messages.",apple
